{
  "claims": [
    {
      "formula": "len_source_array",
      "id": "pluto.returned_rows",
      "inputs": [],
      "kind": "calculation",
      "label": "pluto returned rows in this exact-BBL query",
      "rationale": "Bounded query; see truncation and source limits.",
      "references": [
        {
          "pointer": "",
          "sha256": "1ab74f2aecfbc62c5b9332b0c15960de316480140d344777be6374b445cb2179",
          "source_id": "pluto"
        }
      ],
      "unit": "returned rows; not projects or total population",
      "value": 1
    },
    {
      "formula": null,
      "id": "pluto.0.address",
      "inputs": [],
      "kind": "fact",
      "label": "pluto row 0 address",
      "rationale": null,
      "references": [
        {
          "pointer": "/0/address",
          "sha256": "1ab74f2aecfbc62c5b9332b0c15960de316480140d344777be6374b445cb2179",
          "source_id": "pluto"
        }
      ],
      "unit": "source value",
      "value": "1240 EDWARD L GRANT HWY"
    },
    {
      "formula": null,
      "id": "pluto.0.bbl",
      "inputs": [],
      "kind": "fact",
      "label": "pluto row 0 bbl",
      "rationale": null,
      "references": [
        {
          "pointer": "/0/bbl",
          "sha256": "1ab74f2aecfbc62c5b9332b0c15960de316480140d344777be6374b445cb2179",
          "source_id": "pluto"
        }
      ],
      "unit": "source value",
      "value": "2028710002.00000000"
    },
    {
      "formula": null,
      "id": "pluto.0.bldgarea",
      "inputs": [],
      "kind": "fact",
      "label": "pluto row 0 bldgarea",
      "rationale": null,
      "references": [
        {
          "pointer": "/0/bldgarea",
          "sha256": "1ab74f2aecfbc62c5b9332b0c15960de316480140d344777be6374b445cb2179",
          "source_id": "pluto"
        }
      ],
      "unit": "square feet as recorded",
      "value": "26000"
    },
    {
      "formula": null,
      "id": "pluto.0.bldgclass",
      "inputs": [],
      "kind": "fact",
      "label": "pluto row 0 bldgclass",
      "rationale": null,
      "references": [
        {
          "pointer": "/0/bldgclass",
          "sha256": "1ab74f2aecfbc62c5b9332b0c15960de316480140d344777be6374b445cb2179",
          "source_id": "pluto"
        }
      ],
      "unit": "source value",
      "value": "K1"
    },
    {
      "formula": null,
      "id": "pluto.0.block",
      "inputs": [],
      "kind": "fact",
      "label": "pluto row 0 block",
      "rationale": null,
      "references": [
        {
          "pointer": "/0/block",
          "sha256": "1ab74f2aecfbc62c5b9332b0c15960de316480140d344777be6374b445cb2179",
          "source_id": "pluto"
        }
      ],
      "unit": "source value",
      "value": "2871"
    },
    {
      "formula": null,
      "id": "pluto.0.borough",
      "inputs": [],
      "kind": "fact",
      "label": "pluto row 0 borough",
      "rationale": null,
      "references": [
        {
          "pointer": "/0/borough",
          "sha256": "1ab74f2aecfbc62c5b9332b0c15960de316480140d344777be6374b445cb2179",
          "source_id": "pluto"
        }
      ],
      "unit": "source value",
      "value": "BX"
    },
    {
      "formula": null,
      "id": "pluto.0.builtfar",
      "inputs": [],
      "kind": "fact",
      "label": "pluto row 0 builtfar",
      "rationale": null,
      "references": [
        {
          "pointer": "/0/builtfar",
          "sha256": "1ab74f2aecfbc62c5b9332b0c15960de316480140d344777be6374b445cb2179",
          "source_id": "pluto"
        }
      ],
      "unit": "source value",
      "value": "0.44000000000"
    },
    {
      "formula": null,
      "id": "pluto.0.edesignum",
      "inputs": [],
      "kind": "fact",
      "label": "pluto row 0 edesignum",
      "rationale": null,
      "references": [
        {
          "pointer": "/0/edesignum",
          "sha256": "1ab74f2aecfbc62c5b9332b0c15960de316480140d344777be6374b445cb2179",
          "source_id": "pluto"
        }
      ],
      "unit": "source value",
      "value": "E-442"
    },
    {
      "formula": null,
      "id": "pluto.0.irrlotcode",
      "inputs": [],
      "kind": "fact",
      "label": "pluto row 0 irrlotcode",
      "rationale": null,
      "references": [
        {
          "pointer": "/0/irrlotcode",
          "sha256": "1ab74f2aecfbc62c5b9332b0c15960de316480140d344777be6374b445cb2179",
          "source_id": "pluto"
        }
      ],
      "unit": "source value",
      "value": true
    },
    {
      "formula": null,
      "id": "pluto.0.landuse",
      "inputs": [],
      "kind": "fact",
      "label": "pluto row 0 landuse",
      "rationale": null,
      "references": [
        {
          "pointer": "/0/landuse",
          "sha256": "1ab74f2aecfbc62c5b9332b0c15960de316480140d344777be6374b445cb2179",
          "source_id": "pluto"
        }
      ],
      "unit": "source value",
      "value": "5"
    },
    {
      "formula": null,
      "id": "pluto.0.latitude",
      "inputs": [],
      "kind": "fact",
      "label": "pluto row 0 latitude",
      "rationale": null,
      "references": [
        {
          "pointer": "/0/latitude",
          "sha256": "1ab74f2aecfbc62c5b9332b0c15960de316480140d344777be6374b445cb2179",
          "source_id": "pluto"
        }
      ],
      "unit": "source value",
      "value": "40.8376295"
    },
    {
      "formula": null,
      "id": "pluto.0.longitude",
      "inputs": [],
      "kind": "fact",
      "label": "pluto row 0 longitude",
      "rationale": null,
      "references": [
        {
          "pointer": "/0/longitude",
          "sha256": "1ab74f2aecfbc62c5b9332b0c15960de316480140d344777be6374b445cb2179",
          "source_id": "pluto"
        }
      ],
      "unit": "source value",
      "value": "-73.9218130"
    },
    {
      "formula": null,
      "id": "pluto.0.lot",
      "inputs": [],
      "kind": "fact",
      "label": "pluto row 0 lot",
      "rationale": null,
      "references": [
        {
          "pointer": "/0/lot",
          "sha256": "1ab74f2aecfbc62c5b9332b0c15960de316480140d344777be6374b445cb2179",
          "source_id": "pluto"
        }
      ],
      "unit": "source value",
      "value": "2"
    },
    {
      "formula": null,
      "id": "pluto.0.lotarea",
      "inputs": [],
      "kind": "fact",
      "label": "pluto row 0 lotarea",
      "rationale": null,
      "references": [
        {
          "pointer": "/0/lotarea",
          "sha256": "1ab74f2aecfbc62c5b9332b0c15960de316480140d344777be6374b445cb2179",
          "source_id": "pluto"
        }
      ],
      "unit": "square feet as recorded",
      "value": "59050"
    },
    {
      "formula": null,
      "id": "pluto.0.numfloors",
      "inputs": [],
      "kind": "fact",
      "label": "pluto row 0 numfloors",
      "rationale": null,
      "references": [
        {
          "pointer": "/0/numfloors",
          "sha256": "1ab74f2aecfbc62c5b9332b0c15960de316480140d344777be6374b445cb2179",
          "source_id": "pluto"
        }
      ],
      "unit": "source value",
      "value": "1.0000000"
    },
    {
      "formula": null,
      "id": "pluto.0.overlay1",
      "inputs": [],
      "kind": "fact",
      "label": "pluto row 0 overlay1",
      "rationale": null,
      "references": [
        {
          "pointer": "/0/overlay1",
          "sha256": "1ab74f2aecfbc62c5b9332b0c15960de316480140d344777be6374b445cb2179",
          "source_id": "pluto"
        }
      ],
      "unit": "source value",
      "value": "C2-4"
    },
    {
      "formula": null,
      "id": "pluto.0.residfar",
      "inputs": [],
      "kind": "fact",
      "label": "pluto row 0 residfar",
      "rationale": null,
      "references": [
        {
          "pointer": "/0/residfar",
          "sha256": "1ab74f2aecfbc62c5b9332b0c15960de316480140d344777be6374b445cb2179",
          "source_id": "pluto"
        }
      ],
      "unit": "source value",
      "value": "7.52000000000"
    },
    {
      "formula": null,
      "id": "pluto.0.spdist1",
      "inputs": [],
      "kind": "fact",
      "label": "pluto row 0 spdist1",
      "rationale": null,
      "references": [
        {
          "pointer": "/0/spdist1",
          "sha256": "1ab74f2aecfbc62c5b9332b0c15960de316480140d344777be6374b445cb2179",
          "source_id": "pluto"
        }
      ],
      "unit": "source value",
      "value": "J"
    },
    {
      "formula": null,
      "id": "pluto.0.unitsres",
      "inputs": [],
      "kind": "fact",
      "label": "pluto row 0 unitsres",
      "rationale": null,
      "references": [
        {
          "pointer": "/0/unitsres",
          "sha256": "1ab74f2aecfbc62c5b9332b0c15960de316480140d344777be6374b445cb2179",
          "source_id": "pluto"
        }
      ],
      "unit": "units as recorded; source definition applies",
      "value": "0"
    },
    {
      "formula": null,
      "id": "pluto.0.unitstotal",
      "inputs": [],
      "kind": "fact",
      "label": "pluto row 0 unitstotal",
      "rationale": null,
      "references": [
        {
          "pointer": "/0/unitstotal",
          "sha256": "1ab74f2aecfbc62c5b9332b0c15960de316480140d344777be6374b445cb2179",
          "source_id": "pluto"
        }
      ],
      "unit": "units as recorded; source definition applies",
      "value": "4"
    },
    {
      "formula": null,
      "id": "pluto.0.version",
      "inputs": [],
      "kind": "fact",
      "label": "pluto row 0 version",
      "rationale": null,
      "references": [
        {
          "pointer": "/0/version",
          "sha256": "1ab74f2aecfbc62c5b9332b0c15960de316480140d344777be6374b445cb2179",
          "source_id": "pluto"
        }
      ],
      "unit": "source value",
      "value": "26v2"
    },
    {
      "formula": null,
      "id": "pluto.0.zonedist1",
      "inputs": [],
      "kind": "fact",
      "label": "pluto row 0 zonedist1",
      "rationale": null,
      "references": [
        {
          "pointer": "/0/zonedist1",